{
  "schemaVersion": "1.0",
  "snapshotDate": "2026-08-14",
  "program": {
    "name": "Obserra CMMC Level 2 Dual-Baseline Mapping",
    "owner": "OBSERRA EXECUTIVE PROTECTION & INTELLIGENCE LLC",
    "repository": "jblan2026-hub/obserra-website",
    "workingBranch": "codex/gate36-routing-rebind",
    "startingSourceSha": "ffb08fb2e9cb9033d9a3faf68c653e90c28a7b88",
    "claimBoundary": "Engineering implementation, evidence traceability, and assessment readiness only. This mapping does not claim a MET assessment result, CMMC certification, CMMC status in SPRS, authorization to process CUI, FedRAMP authorization, or FDACS approval."
  },
  "baselines": {
    "cmmcLevel2Assessment": {
      "publication": "NIST SP 800-171 Rev. 2",
      "assessmentPublication": "NIST SP 800-171A Jun2018",
      "requirementCount": 110,
      "assessmentStatus": "not_assessed"
    },
    "forwardEngineering": {
      "publication": "NIST SP 800-171 Rev. 3",
      "assessmentPublication": "NIST SP 800-171A Rev. 3",
      "activeRequirementCount": 97,
      "withdrawnIdentifierCount": 33,
      "registry": "docs/florida-class-d-lms/CMMC-LEVEL-2-REV3-TRACEABILITY.json"
    }
  },
  "scopeState": {
    "formalCuiAssessmentScopeEstablished": false,
    "sspComplete": false,
    "assetInventoryComplete": false,
    "networkAndDataFlowDiagramsComplete": false,
    "cuiProcessingAuthorized": false
  },
  "mappingPolicy": {
    "directIdentifierRule": "A Rev. 2 identifier maps to the zero-padded identifier in Rev. 3 when that identifier remains active. If the zero-padded identifier is listed as withdrawn, the record reports withdrawn rather than inventing a semantic replacement.",
    "implementationRule": "Implementation trace records are inherited from the controlled Rev. 3 registry only when they explicitly list the Rev. 2 identifier. Evidence availability is not a CMMC assessment result.",
    "assessmentRule": "Every Rev. 2 requirement remains not_assessed until all applicable NIST SP 800-171A Jun2018 determination statements are evaluated for the approved CMMC Assessment Scope.",
    "rev3OnlyRule": "Active Rev. 3 requirements without a same-number Rev. 2 requirement remain visible as Rev. 3-only engineering requirements."
  },
  "authoritativeSources": [
    "https://www.ecfr.gov/current/title-32/subtitle-A/chapter-I/subchapter-G/part-170/subpart-D/section-170.16",
    "https://www.ecfr.gov/current/title-32/subtitle-A/chapter-I/subchapter-G/part-170/subpart-D/section-170.17",
    "https://dodcio.defense.gov/Portals/0/Documents/CMMC/AssessmentGuideL2v2.pdf",
    "https://csrc.nist.gov/pubs/sp/800/171/r2/upd1/final",
    "https://csrc.nist.gov/pubs/sp/800/171/r3/final",
    "https://csrc.nist.gov/pubs/sp/800/171/a/r3/final"
  ],
  "outputs": {
    "schema": "docs/florida-class-d-lms/CMMC-LEVEL-2-DUAL-BASELINE-MAPPING.schema.json",
    "generator": "scripts/cmmc-level2-dual-baseline.mjs",
    "humanReadable": "docs/florida-class-d-lms/CMMC-LEVEL-2-DUAL-BASELINE-MATRIX.md",
    "digest": "docs/florida-class-d-lms/CMMC-LEVEL-2-DUAL-BASELINE-MAPPING.sha256",
    "ciCommand": "npm run verify:cmmc-dual-baseline"
  },
  "rev2Families": {
    "3.1": {
      "code": "AC",
      "name": "Access Control",
      "requirements": [
        ["3.1.1", "Authorized Access Control"],
        ["3.1.2", "Transaction and Function Control"],
        ["3.1.3", "Control CUI Flow"],
        ["3.1.4", "Separation of Duties"],
        ["3.1.5", "Least Privilege"],
        ["3.1.6", "Non-Privileged Account Use"],
        ["3.1.7", "Privileged Functions"],
        ["3.1.8", "Unsuccessful Logon Attempts"],
        ["3.1.9", "Privacy and Security Notices"],
        ["3.1.10", "Session Lock"],
        ["3.1.11", "Session Termination"],
        ["3.1.12", "Control Remote Access"],
        ["3.1.13", "Remote Access Confidentiality"],
        ["3.1.14", "Remote Access Routing"],
        ["3.1.15", "Privileged Remote Access"],
        ["3.1.16", "Wireless Access Authorization"],
        ["3.1.17", "Wireless Access Protection"],
        ["3.1.18", "Mobile Device Connection"],
        ["3.1.19", "Encrypt CUI on Mobile"],
        ["3.1.20", "External Connections"],
        ["3.1.21", "Portable Storage Use"],
        ["3.1.22", "Control Public Information"]
      ]
    },
    "3.2": {
      "code": "AT",
      "name": "Awareness and Training",
      "requirements": [
        ["3.2.1", "Role-Based Risk Awareness"],
        ["3.2.2", "Role-Based Training"],
        ["3.2.3", "Insider Threat Awareness"]
      ]
    },
    "3.3": {
      "code": "AU",
      "name": "Audit and Accountability",
      "requirements": [
        ["3.3.1", "System Auditing"],
        ["3.3.2", "User Accountability"],
        ["3.3.3", "Event Review"],
        ["3.3.4", "Audit Failure Alerting"],
        ["3.3.5", "Audit Correlation"],
        ["3.3.6", "Reduction and Reporting"],
        ["3.3.7", "Authoritative Time Source"],
        ["3.3.8", "Audit Protection"],
        ["3.3.9", "Audit Management"]
      ]
    },
    "3.4": {
      "code": "CM",
      "name": "Configuration Management",
      "requirements": [
        ["3.4.1", "System Baselining"],
        ["3.4.2", "Security Configuration Enforcement"],
        ["3.4.3", "System Change Management"],
        ["3.4.4", "Security Impact Analysis"],
        ["3.4.5", "Access Restrictions for Change"],
        ["3.4.6", "Least Functionality"],
        ["3.4.7", "Nonessential Functionality"],
        ["3.4.8", "Application Execution Policy"],
        ["3.4.9", "User-Installed Software"]
      ]
    },
    "3.5": {
      "code": "IA",
      "name": "Identification and Authentication",
      "requirements": [
        ["3.5.1", "Identification"],
        ["3.5.2", "Authentication"],
        ["3.5.3", "Multifactor Authentication"],
        ["3.5.4", "Replay-Resistant Authentication"],
        ["3.5.5", "Identifier Reuse"],
        ["3.5.6", "Identifier Handling"],
        ["3.5.7", "Password Complexity"],
        ["3.5.8", "Password Reuse"],
        ["3.5.9", "Temporary Passwords"],
        ["3.5.10", "Cryptographically Protected Passwords"],
        ["3.5.11", "Obscure Feedback"]
      ]
    },
    "3.6": {
      "code": "IR",
      "name": "Incident Response",
      "requirements": [
        ["3.6.1", "Incident Handling"],
        ["3.6.2", "Incident Reporting"],
        ["3.6.3", "Incident Response Testing"]
      ]
    },
    "3.7": {
      "code": "MA",
      "name": "Maintenance",
      "requirements": [
        ["3.7.1", "Perform Maintenance"],
        ["3.7.2", "System Maintenance Control"],
        ["3.7.3", "Equipment Sanitization"],
        ["3.7.4", "Media Inspection"],
        ["3.7.5", "Nonlocal Maintenance"],
        ["3.7.6", "Maintenance Personnel"]
      ]
    },
    "3.8": {
      "code": "MP",
      "name": "Media Protection",
      "requirements": [
        ["3.8.1", "Media Protection"],
        ["3.8.2", "Media Access"],
        ["3.8.3", "Media Disposal"],
        ["3.8.4", "Media Markings"],
        ["3.8.5", "Media Accountability"],
        ["3.8.6", "Portable Storage Encryption"],
        ["3.8.7", "Removable Media"],
        ["3.8.8", "Shared Media"],
        ["3.8.9", "Protect Backups"]
      ]
    },
    "3.9": {
      "code": "PS",
      "name": "Personnel Security",
      "requirements": [
        ["3.9.1", "Screen Individuals"],
        ["3.9.2", "Personnel Actions"]
      ]
    },
    "3.10": {
      "code": "PE",
      "name": "Physical Protection",
      "requirements": [
        ["3.10.1", "Limit Physical Access"],
        ["3.10.2", "Monitor Facility"],
        ["3.10.3", "Escort Visitors"],
        ["3.10.4", "Physical Access Logs"],
        ["3.10.5", "Manage Physical Access"],
        ["3.10.6", "Alternative Work Sites"]
      ]
    },
    "3.11": {
      "code": "RA",
      "name": "Risk Assessment",
      "requirements": [
        ["3.11.1", "Risk Assessments"],
        ["3.11.2", "Vulnerability Scan"],
        ["3.11.3", "Vulnerability Remediation"]
      ]
    },
    "3.12": {
      "code": "CA",
      "name": "Security Assessment",
      "requirements": [
        ["3.12.1", "Security Control Assessment"],
        ["3.12.2", "Operational Plan of Action"],
        ["3.12.3", "Security Control Monitoring"],
        ["3.12.4", "System Security Plan"]
      ]
    },
    "3.13": {
      "code": "SC",
      "name": "System and Communications Protection",
      "requirements": [
        ["3.13.1", "Boundary Protection"],
        ["3.13.2", "Security Engineering"],
        ["3.13.3", "Role Separation"],
        ["3.13.4", "Shared Resource Control"],
        ["3.13.5", "Public-Access System Separation"],
        ["3.13.6", "Network Communication by Exception"],
        ["3.13.7", "Split Tunneling"],
        ["3.13.8", "Data in Transit"],
        ["3.13.9", "Connections Termination"],
        ["3.13.10", "Key Management"],
        ["3.13.11", "CUI Encryption"],
        ["3.13.12", "Collaborative Device Control"],
        ["3.13.13", "Mobile Code"],
        ["3.13.14", "Voice over Internet Protocol"],
        ["3.13.15", "Communications Authenticity"],
        ["3.13.16", "Data at Rest"]
      ]
    },
    "3.14": {
      "code": "SI",
      "name": "System and Information Integrity",
      "requirements": [
        ["3.14.1", "Flaw Remediation"],
        ["3.14.2", "Malicious Code Protection"],
        ["3.14.3", "Security Alerts and Advisories"],
        ["3.14.4", "Update Malicious Code Protection"],
        ["3.14.5", "System and File Scanning"],
        ["3.14.6", "Monitor Communications for Attacks"],
        ["3.14.7", "Identify Unauthorized Use"]
      ]
    }
  }
}
